{
  "run_date": "20260409",
  "section_id": "overall_summary",
  "title": "전체 개황",
  "body": "초반에는 한반도 주변 상층에서 강한 제트 스트림과 저기압 순환이 형성되어 지역별로 북서-남동 방향의 강한 제트축과 저기압 중심이 관측되었다. 이후 이러한 상층 기압계의 발달과 이동으로 인해 지상에서는 복잡한 기압골과 능선축이 나타나며, 한반도 전역에 걸쳐 강한 한랭 및 온난 이류가 공존하는 상태가 지속되었다. 동시에 습윤 기류대와 대류운 군집이 북서 지역에서부터 한반도 전역으로 확장되었고, 저기압성 소용돌이 구름과 결합하며 광범위한 강수대와 강풍역이 동반되는 상황으로 심화되었다. 후반에는 이러한 상하층의 상호작용에 의해 한반도 북서와 북동 지역까지 강풍대와 집중 강수대가 확대되면서 대기 불안정이 극대화되었다. 따라서 상층의 제트 스트림 강화와 저기압 순환이 지상 기압계와 습윤 대류 구름의 강화로 이어져 한반도 전역에 걸친 강풍과 강수 현상을 주도하였다.",
  "observation_basis": [
    "300hPa: Central Korea 제트축 2회, Central Korea 제트코어 2회, East Sea 제트축 2회, East Sea 제트코어 2회",
    "500hPa: East Sea 능선축 2회, 한반도 북동 강한 고도경도대 2회, 한반도 북부 폐합성 저기압성 순환 2회, Central Korea 기압골축 1회",
    "850hPa: Central Korea 기압골축 2회, Central Korea 습윤역 2회, Central Korea 한랭이류 2회, East Sea 온난이류 2회",
    "925hPa: Central Korea 습윤역 2회, East Sea 습윤역 2회, 동중국해 북부 온난이류 2회, 동중국해 북부 저층 능선 2회",
    "surface: Central Korea 습윤역 2회, Central Korea 저기압 중심 2회, Central Korea 전선 2회, East Sea 습윤역 2회",
    "satellite_wv: East Sea 습윤 기류대 2회, 일본 동부 해상 대류운 군집 2회, 일본 서부 습윤 기류대 2회, Central Korea 띠구름 1회",
    "radar_precipitation: 동해 북부 convective_core 2회, 동해 북부 precip_echo 2회, 동해 북부 rain_band 2회, Central Korea convective_core 1회"
  ],
  "applied_patterns": [
    "jet_coupling_heavy_rain, 섹션 13, p.98-101",
    "explosive_cyclone_risk, 섹션 24, p.210-217",
    "mcs_convective_stratiform_split, 섹션 14, p.102-113",
    "skewt_llj_heavy_rain, 섹션 5, p.34-43"
  ],
  "source_event_ids": [
    "overall_summary_01",
    "overall_summary_02"
  ]
}