{
  "run_date": "20260409",
  "section_id": "synoptic_analysis",
  "title": "종관 해석",
  "body": "현재 한반도 주변 대기 상황은 상층 제트코어 및 중간 고도에서의 기압계 변화와 밀접하게 연관되어 있다. 초반에는 동중국해 북부와 한반도 인근에서 강한 제트코어가 관측되어 이로 인해 상층의 기압골과 능선 배치가 변화하며 대기 불안정성이 증가하였다. 이후 500hPa에서는 한반도 남부와 만주 남부 일대에서 폐합성 저기압과 강한 한랭핵이 나타났는데, 이들 기압계는 초기 폐합성 저기압의 활성화로 강도가 변화하며, 한랭핵은 규모가 광역으로 확대되어 고도경도대가 강화되고 대기 불안정을 더욱 증대시켰다. 후반으로 갈수록 한반도 전역 및 동중국해 북부 지역에서 상층 제트코어 강도와 위치가 변동하며 중규모 기압계의 발달을 유도하였고, 이와 함께 300hPa에서는 아열대 제트축과 한대 제트축이 혼재하며 그 상호작용으로 인해 기압골과 능선 형태가 변화하여 한반도 주변 대기 흐름에 중요한 영향을 미쳤다. 따라서 상하층의 기압계 변화와 제트축 상호작용이 복합적으로 작용하여 이번 기간 동안 한반도 주변의 대기 불안정성이 크게 확장되었다고 평가된다.",
  "observation_basis": [
    "300hPa: 동중국해 북부 제트축 2회, 동중국해 북부 제트코어 2회, 동해 북부 제트축 2회, 동해 북부 제트코어 2회",
    "500hPa: 동해 북부 능선축 2회, 한반도 남동 폐합성 저기압성 순환 2회, 한반도 북서 강한 고도경도대 2회, 동중국해 북부 기압골축 1회"
  ],
  "applied_patterns": [
    "upper_jet_quadrant_selection, 섹션 13, p.98-101",
    "jet_coupling_heavy_rain, 섹션 13, p.98-101",
    "explosive_cyclone_risk, 섹션 24, p.210-217",
    "hail_cold_core_shear, 섹션 23, p.200-209",
    "spring_heat_low_vs_frontal_low, 섹션 1, p.4-11",
    "upper_difffluence_heavy_rain, 섹션 2, p.12-17"
  ],
  "source_event_ids": [
    "synoptic_analysis_01",
    "synoptic_analysis_02",
    "synoptic_analysis_03"
  ]
}