{
  "run_date": "20260409",
  "section_id": "surface_marine_impacts",
  "title": "지상 및 해상 영향 해석",
  "body": "한반도 동쪽 및 동중국해 북부에서 저기압이 발달함에 따라 강풍과 습윤 영역이 점차 확대되며 해상과 지상 기상 조건이 악화되었다. 초반에는 저기압 중심과 전선대가 광역에 걸쳐 형성되면서 강풍대와 습윤역이 시작되었고, 이후 전선대의 유형 변화와 이동 속도 증가가 해상 강풍 역세를 동반하며 강풍 분포와 강도를 변화시켰다. 후반에는 저기압과 전선이 동쪽으로 움직이며 강한 기압경도대가 형성되어 풍속과 강수 가능성이 증가하는 동시에, 요동반도와 만주 남부의 고기압과 저기압 배치 변화가 기압분포에 영향을 미쳐 지역 기상 상황의 변화를 촉진하였다. 따라서 이러한 저기압 중심의 발달과 전선 이동, 전선대 유형 변화 그리고 인근 지역의 기압 배치 변화가 종합적으로 지상 및 해상 기상 악화를 야기하였다.",
  "observation_basis": [
    "surface: 동중국해 북부 습윤역 2회, 동중국해 북부 저기압 중심 2회, 동중국해 북부 전선 2회, 만주 남부 습윤역 2회",
    "sfc12h_synoptic: 동중국해 북부 전선대 2회, 동중국해 북부 종관 규모 저기압 중심 2회, 동중국해 북부 지상 기압골축 2회, 만주 남부 전선대 2회"
  ],
  "applied_patterns": [
    "front_boundary_identification, 섹션 9, p.68-77",
    "explosive_cyclone_risk, 섹션 24, p.210-217",
    "spring_heat_low_vs_frontal_low, 섹션 1, p.4-11"
  ],
  "source_event_ids": [
    "surface_marine_impacts_01",
    "surface_marine_impacts_02",
    "surface_marine_impacts_03"
  ]
}